{
  "schema_version": 1,
  "improving_concept": "improve flexibility",
  "worsening_concept": "increase complexity",
  "domain_signals": [
    "software"
  ],
  "exotic_signals": [],
  "contradiction_type": "engineering-contradiction",
  "domain_class": "software",
  "framing_confidence": "low",
  "constraints": []
}